"Code","Libellé","Nb total de séjours/séances","Nb de séjourshors GHM en J ou T et séances","DMS (en nuitée)hors GHM en J ou Tet séances","Nb de séjoursGHM en J ou T hors séances","Nb de nuitéesen GHM J ou T","Nb de séances"
"I880","Lymphadénite mésentérique non spécifique","4 591","1 370","3,03","3 221","2 153","0"
"I881","Lymphadénite chronique, sauf mésentérique","218","109","3,77","109","1 à 10","0"
"I888","Autres lymphadénites non spécifiques","308","193","4,32","115","0","0"
"I889","Lymphadénite (non spécifique), sans précision","346","225","4,10","121","0","0"
"","Total","5 463","1 897","","3 566","","0"
