"Code","Libellé","Nb total de séjours/séances","Nb de séjourshors GHM en J ou T et séances","DMS (en nuitée)hors GHM en J ou Tet séances","Nb de séjoursGHM en J ou T hors séances","Nb de nuitéesen GHM J ou T","Nb de séances"
"E10","Diabète sucré de type 1","32 921","23 013","6,36","9 908","2 327","0"
"E11","Diabète sucré de type 2","67 559","53 727","6,93","13 832","3 140","0"
"E12","Diabète sucré de malnutrition","54","36","12,83","18","12","0"
"E13","Autres diabètes sucrés précisés","3 409","2 793","7,23","616","168","0"
"E14","Diabète sucré, sans précision","2 406","1 729","7,50","677","372","0"
"","Total","106 349","81 298","","25 051","","0"
