"Code","Libellé","Nb total de séjours/séances","Nb de séjourshors GHM en J ou T et séances","DMS (en nuitée)hors GHM en J ou Tet séances","Nb de séjoursGHM en J ou T hors séances","Nb de nuitéesen GHM J ou T","Nb de séances"
"L890","Zone de pression et ulcère de décubitus de stade I","186","106","11,00","80","0","0"
"L891","Ulcère de décubitus de stade II","767","479","11,18","288","0","0"
"L892","Ulcère de décubitus de stade III","1 889","1 294","13,95","595","0","0"
"L893","Ulcère de décubitus de stade IV","4 112","3 494","16,71","618","0","0"
"L899","Ulcère de décubitus et zone de pression, sans précision","291","151","7,68","140","0","0"
"","Total","7 245","5 524","","1 721","","0"
