Code,Libellé,Nb total de séjours/séances,Nb de séjourshors GHM en J ou T et séances,DMS (en nuitée)hors GHM en J ou Tet séances,Nb de séjoursGHM en J ou T hors séances,Nb de nuitéesen GHM J ou T,Nb de séances
C090,Tumeur maligne de la fosse amygdalienne,349,195,"7,35",154,0,0
C091,Tumeur maligne du pilier de l'amygdale (antérieur) (postérieur),168,97,"8,71",71,0,0
C098,Tumeur maligne à localisations contiguës de l'amygdale,256,139,"6,51",117,0,0
C099,"Tumeur maligne de l'amygdale, sans précision",1 088,644,"6,88",444,0,0
"",Total,1 861,1 075,"",786,"",0
