Code,Libellé,Nb total de séjours/séances,Nb de séjourshors GHM en J ou T et séances,DMS (en nuitée)hors GHM en J ou Tet séances,Nb de séjoursGHM en J ou T hors séances,Nb de nuitéesen GHM J ou T,Nb de séances
S430,Luxation de l'articulation de l'épaule,9 829,8 450,"1,66",1 379,242,0
S431,Luxation de l'articulation acromio-claviculaire,1 420,882,"1,82",538,1 à 10,0
S432,Luxation de l'articulation sterno-claviculaire,118,109,"1,88",1 à 10,0,0
S433,Luxation de parties autres et non précisées de la ceinture scapulaire,36,30,"1,97",1 à 10,1 à 10,0
S434,Entorse et foulure de l'articulation de l'épaule,156,128,"3,19",28,0,0
S435,Entorse et foulure de l'articulation acromio-claviculaire,139,124,"1,05",15,1 à 10,0
S437,Entorse et foulure de parties autres et non précisées de la ceinture scapulaire,318,312,"0,33",1 à 10,1 à 10,0
"",Total,12 018,10 037,"",1 981,"",0
