Code,Libellé,Nb total de séjours/séances,Nb de séjourshors GHM en J ou T et séances,DMS (en nuitée)hors GHM en J ou Tet séances,Nb de séjoursGHM en J ou T hors séances,Nb de nuitéesen GHM J ou T,Nb de séances
T520,Effet toxique de produits dérivés du pétrole,59,20,"4,85",39,23,0
T523,Effet toxique des glycols,14,1 à 10,NA,1 à 10,1 à 10,0
T524,Effet toxique des cétones,22,1 à 10,NA,13,1 à 10,0
T528,Effet toxique d'autres solvants organiques,109,44,"7,43",65,44,0
T529,"Effet toxique d'un solvant organique, sans précision",54,1 à 10,NA,45,29,0
"",Total,261,90,"",171,"",0
