Code,Libellé,Nb total de séjours/séances,Nb de séjourshors GHM en J ou T et séances,DMS (en nuitée)hors GHM en J ou Tet séances,Nb de séjoursGHM en J ou T hors séances,Nb de nuitéesen GHM J ou T,Nb de séances
Q550,Absence (congénitale) et aplasie du testicule,95,35,"0,40",60,0,0
Q552,Autres malformations congénitales du (des) testicule(s) et du scrotum,57,13,"1,23",44,0,0
Q554,"Autres malformations congénitales du canal déférent, de l'épididyme, des vésicules séminales et de la prostate",58,17,"1,06",41,0,0
Q556,Autres malformations congénitales du pénis,708,142,"1,89",566,0,0
Q558,Autres malformations congénitales précisées des organes génitaux de l'homme,48,1 à 10,NA,39,0,0
Q559,"Malformation congénitale des organes génitaux de l'homme, sans précision",12,0,"",12,0,0
"",Total,984,219,"",765,"",0
