"Code","Libellé","Nb total de séjours/séances","Nb de séjourshors GHM en J ou T et séances","DMS (en nuitée)hors GHM en J ou Tet séances","Nb de séjoursGHM en J ou T hors séances","Nb de nuitéesen GHM J ou T","Nb de séances"
"H330","Décollement de la rétine avec déchirure rétinienne","10 574","2 991","1,41","7 583","0","0"
"H331","Rétinoschisis et kystes rétiniens","28","1 à 10","NA","18","0","0"
"H332","Décollement (séreux) de la rétine","1 684","639","1,54","1 045","0","0"
"H333","Déchirures rétiniennes sans décollement","601","48","1,44","553","0","0"
"H334","Décollement par traction de la rétine","697","162","1,94","535","0","0"
"H335","Autres décollements rétiniens","883","249","1,44","634","0","0"
"","Total","14 467","4 099","","10 368","","0"
