"Code","Libellé","Nb total de séjours/séances","Nb de séjourshors GHM en J ou T et séances","DMS (en nuitée)hors GHM en J ou Tet séances","Nb de séjoursGHM en J ou T hors séances","Nb de nuitéesen GHM J ou T","Nb de séances"
"C000","Tumeur maligne de la lèvre supérieure, (bord libre)","93","38","3,92","55","0","0"
"C001","Tumeur maligne de la lèvre inférieure, (bord libre)","292","179","5,07","113","1 à 10","0"
"C004","Tumeur maligne de la lèvre inférieure, face interne","24","19","5,16","1 à 10","0","0"
"C006","Tumeur maligne de la commissure des lèvres","16","1 à 10","NA","1 à 10","0","0"
"C009","Tumeur maligne de la lèvre, sans précision","13","1 à 10","NA","1 à 10","0","0"
"","Total","458","260","","198","","0"
