Code,Libellé,Nb total de séjours/séances,Nb de séjourshors GHM en J ou T et séances,DMS (en nuitée)hors GHM en J ou Tet séances,Nb de séjoursGHM en J ou T hors séances,Nb de nuitéesen GHM J ou T,Nb de séances
P130,Fracture du crâne due à un traumatisme obstétrical,27,27,"4,93",0,0,0
P132,Lésion du fémur due à un traumatisme obstétrical,19,19,"4,89",0,0,0
P133,Lésion d'autres os longs due à un traumatisme obstétrical,25,25,"6,56",0,0,0
P134,Fracture de la clavicule due à un traumatisme obstétrical,44,44,"4,61",0,0,0
"",Total,129,129,"",0,"",0
