"Code","Libellé","Nb total de séjours/séances","Nb de séjourshors GHM en J ou T et séances","DMS (en nuitée)hors GHM en J ou Tet séances","Nb de séjoursGHM en J ou T hors séances","Nb de nuitéesen GHM J ou T","Nb de séances"
"I660","Occlusion et sténose de l'artère cérébrale moyenne","170","140","6,62","30","0","0"
"I661","Occlusion et sténose de l'artère cérébrale antérieure","28","24","8,33","1 à 10","0","0"
"I662","Occlusion et sténose de l'artère cérébrale postérieure","101","82","5,90","19","0","0"
"I663","Occlusion et sténose des artères cérébelleuses","24","18","9,94","1 à 10","0","0"
"I664","Occlusion et sténose des artères cérébrales, multiples et bilatérales","26","20","7,45","1 à 10","0","0"
"I668","Occlusion et sténose d'une autre artère cérébrale","76","58","6,00","18","0","0"
"I669","Occlusion et sténose d'une artère cérébrale, sans précision","40","29","5,14","11","0","0"
"","Total","465","371","","94","","0"
