"Code","Libellé","Nb total de séjours/séances","Nb de séjourshors GHM en J ou T et séances","DMS (en nuitée)hors GHM en J ou Tet séances","Nb de séjoursGHM en J ou T hors séances","Nb de nuitéesen GHM J ou T","Nb de séances"
"I340","Insuffisance (de la valvule) mitrale (non rhumatismale)","5 758","4 824","11,00","934","134","0"
"I341","Prolapsus (de la valvule) mitral(e)","989","832","11,18","157","33","0"
"I342","Sténose non rhumatismale (de la valvule) mitrale","411","367","12,91","44","1 à 10","0"
"I348","Autres atteintes non rhumatismales de la valvule mitrale","90","69","11,22","21","1 à 10","0"
"I349","Atteinte non rhumatismale de la valvule mitrale, sans précision","25","14","13,57","11","1 à 10","0"
"","Total","7 273","6 106","","1 167","","0"
