Code,Libellé,Nb total de séjours/séances,Nb de séjourshors GHM en J ou T et séances,DMS (en nuitée)hors GHM en J ou Tet séances,Nb de séjoursGHM en J ou T hors séances,Nb de nuitéesen GHM J ou T,Nb de séances
P590,Ictère néonatal associé à un accouchement avant terme,889,889,"6,99",0,0,0
P592,"Ictère néonatal dû à des lésions hépatocellulaires, autres et sans précision",25,25,"5,76",0,0,0
P593,Ictère néonatal dû à des inhibiteurs de la lactation,170,170,"3,49",0,0,0
P598,Ictère néonatal dû à d'autres causes précisées,2 870,2 870,"4,92",0,0,0
P599,"Ictère néonatal, sans précision",5 354,5 354,"4,62",0,0,0
"",Total,9 316,9 316,"",0,"",0
