"Code","Libellé","Nb total de séjours/séances","Nb de séjourshors GHM en J ou T et séances","DMS (en nuitée)hors GHM en J ou Tet séances","Nb de séjoursGHM en J ou T hors séances","Nb de nuitéesen GHM J ou T","Nb de séances"
"K90","Malabsorption intestinale","1 600","577","7,50","1 023","124","0"
"K91","Atteintes de l'appareil digestif après un acte à visée diagnostique et thérapeutique, non classées ailleurs","6 586","4 636","8,37","1 950","623","0"
"K92","Autres maladies du système digestif","23 387","15 448","8,06","7 939","4 715","0"
"K93","Atteintes d'autres organes de l'appareil digestif au cours de maladies classées ailleurs","404","287","13,84","117","23","0"
"","Total","31 977","20 948","","11 029","","0"
