"Code","Libellé","Nb total de séjours/séances","Nb de séjourshors GHM en J ou T et séances","DMS (en nuitée)hors GHM en J ou Tet séances","Nb de séjoursGHM en J ou T hors séances","Nb de nuitéesen GHM J ou T","Nb de séances"
"C851","Lymphomes à cellules B, sans précision","1 332","947","11,60","385","0","0"
"C852","Lymphome médiastinal (thymique) à grandes cellules B","214","192","9,29","22","0","0"
"C857","Autres types précisés de lymphome non hodgkinien","179","116","15,24","63","0","0"
"C859","Lymphome non hodgkinien, non précisé","611","457","13,21","154","0","0"
"","Total","2 336","1 712","","624","","0"
