"Code","Libellé","Nb total de séjours/séances","Nb de séjourshors GHM en J ou T et séances","DMS (en nuitée)hors GHM en J ou Tet séances","Nb de séjoursGHM en J ou T hors séances","Nb de nuitéesen GHM J ou T","Nb de séances"
"K750","Abcès du foie","3 273","2 889","13,68","384","205","0"
"K751","Phlébite de la veine porte","28","26","7,35","1 à 10","0","0"
"K752","Hépatite réactive non spécifique","85","75","5,55","1 à 10","0","0"
"K753","Hépatite granulomateuse, non classée ailleurs","73","41","5,78","32","0","0"
"K754","Hépatite auto-immune","1 194","796","7,95","398","0","0"
"K758","Autres maladies inflammatoires précisées du foie","553","271","5,22","282","0","0"
"K759","Maladie inflammatoire du foie, sans précision","214","168","4,82","46","0","0"
"","Total","5 420","4 266","","1 154","","0"
