"Code","Libellé","Nb total de séjours/séances","Nb de séjourshors GHM en J ou T et séances","DMS (en nuitée)hors GHM en J ou Tet séances","Nb de séjoursGHM en J ou T hors séances","Nb de nuitéesen GHM J ou T","Nb de séances"
"D310","Tumeur bénigne de la conjonctive","390","24","1,63","366","0","0"
"D311","Tumeur bénigne de la cornée","35","1 à 10","NA","28","0","0"
"D312","Tumeur bénigne de la rétine","15","1 à 10","NA","13","0","0"
"D313","Tumeur bénigne de la choroïde","140","1 à 10","NA","136","0","0"
"D314","Tumeur bénigne du corps ciliaire","24","0","","24","0","0"
"D315","Tumeur bénigne de la glande lacrymale et du canal lacrymal","42","22","1,91","20","0","0"
"D316","Tumeur bénigne de l'orbite, sans précision","199","105","3,06","94","0","0"
"D319","Tumeur bénigne de l'oeil, sans précision","17","1 à 10","NA","14","0","0"
"","Total","862","167","","695","","0"
