"Code","Libellé","Nb total de séjours/séances","Nb de séjourshors GHM en J ou T et séances","DMS (en nuitée)hors GHM en J ou Tet séances","Nb de séjoursGHM en J ou T hors séances","Nb de nuitéesen GHM J ou T","Nb de séances"
"N20","Calcul du rein et de l'uretère","65 052","24 662","2,58","40 390","4 266","0"
"N21","Calcul des voies urinaires inférieures","3 706","2 029","2,86","1 677","291","0"
"N22","Calcul des voies urinaires au cours de maladies classées ailleurs","29","13","3,77","16","1 à 10","0"
"N23","Colique néphrétique, sans précision","27 148","4 130","2,60","23 018","8 025","0"
"","Total","95 935","30 834","","65 101","","0"
