Code,Libellé,Nb total de séjours/séances,Nb de séjourshors GHM en J ou T et séances,DMS (en nuitée)hors GHM en J ou Tet séances,Nb de séjoursGHM en J ou T hors séances,Nb de nuitéesen GHM J ou T,Nb de séances
O600,Travail prématuré sans accouchement,16 529,12 486,"4,43",4 043,2 132,0
O601,Travail prématuré spontané avec accouchement prématuré,7 076,6 772,"7,43",304,196,0
O602,Travail prématuré spontané avec accouchement à terme,128,124,"6,26",1 à 10,1 à 10,0
O603,Accouchement prématuré sans travail spontané,1 246,1 241,"11,09",1 à 10,1 à 10,0
"",Total,24 979,20 623,"",4 356,"",0
