"Code","Libellé","Nb total de séjours/séances","Nb de séjourshors GHM en J ou T et séances","DMS (en nuitée)hors GHM en J ou Tet séances","Nb de séjoursGHM en J ou T hors séances","Nb de nuitéesen GHM J ou T","Nb de séances"
"150100000","Grossesse se terminant par un avortement","196 966","164 213","0,27","32 753","3 727","0"
"150200000","Oedème, protéinurie et hypertension au cours de la grossesse, de l'accouchement et de la puerpéralité","17 665","16 125","6,36","1 540","87","0"
"150300000","Autres affections maternelles liées principalement à la grossesse","74 752","39 776","3,84","34 976","942","0"
"150400000","Soins maternels liés au foetus et à la cavité amniotique, et problèmes possibles posés par l'accouchement","162 789","137 031","4,93","25 758","6 646","0"
"150500000","Complications du travail et de l'accouchement","234 203","227 510","4,91","6 693","3 620","0"
"150600000","Accouchement","169 512","167 847","4,01","1 665","1 173","0"
"150700000","Complications principalement liées à la puerpéralité","3 971","3 050","4,37","921","514","0"
"150800000","Autres problèmes obstétricaux, non classés ailleurs","16 851","12 028","3,99","4 823","157","0"
"","Total","876 709","767 580","","109 129","","0"
