"Code","Libellé","Nb total de séjours/séances","Nb de séjourshors GHM en J ou T et séances","DMS (en nuitée)hors GHM en J ou Tet séances","Nb de séjoursGHM en J ou T hors séances","Nb de nuitéesen GHM J ou T","Nb de séances"
"D590","Anémie hémolytique auto-immune, due à des médicaments","80","70","10,26","1 à 10","1 à 10","0"
"D591","Autres anémies hémolytiques auto-immunes","1 582","1 360","10,43","222","128","0"
"D592","Anémie hémolytique non auto-immune, due à des médicaments","63","51","7,27","12","1 à 10","0"
"D593","Syndrome hémolytique urémique","332","235","11,56","97","35","0"
"D594","Autres anémies hémolytiques non auto-immunes","170","140","7,09","30","26","0"
"D595","Hémoglobinurie nocturne paroxystique [Marchiafava-Micheli]","39","23","10,96","16","1 à 10","0"
"D598","Autres anémies hémolytiques acquises","250","197","8,19","53","35","0"
"D599","Anémie hémolytique acquise, sans précision","422","313","7,69","109","74","0"
"","Total","2 943","2 392","","551","","0"
