"Code","Libellé","Nb total de séjours/séances","Nb de séjourshors GHM en J ou T et séances","DMS (en nuitée)hors GHM en J ou Tet séances","Nb de séjoursGHM en J ou T hors séances","Nb de nuitéesen GHM J ou T","Nb de séances"
"C340","Tumeur maligne de la bronche souche","1 283","949","13,17","334","75","0"
"C341","Tumeur maligne du lobe supérieur, bronches ou poumon","17 246","12 749","10,26","4 497","1 598","0"
"C342","Tumeur maligne du lobe moyen, bronches ou poumon","1 465","1 085","9,37","380","125","0"
"C343","Tumeur maligne du lobe inférieur, bronches ou poumon","9 286","6 721","9,60","2 565","924","0"
"C348","Tumeur maligne à localisations contiguës des bronches et du poumon","2 169","1 382","12,67","787","156","0"
"C349","Tumeur maligne de bronche ou du poumon, sans précision","16 028","10 694","12,24","5 334","1 403","0"
"","Total","47 477","33 580","","13 897","","0"
