"Code","Libellé","Nb total de séjours/séances","Nb de séjourshors GHM en J ou T et séances","DMS (en nuitée)hors GHM en J ou Tet séances","Nb de séjoursGHM en J ou T hors séances","Nb de nuitéesen GHM J ou T","Nb de séances"
"D090","Carcinome in situ de la vessie","1 212","1 162","3,49","50","1 à 10","0"
"D091","Carcinome in situ d'organes urinaires, autres et non précisés","45","40","5,45","1 à 10","1 à 10","0"
"D092","Carcinome in situ de l'oeil","135","32","1,56","103","0","0"
"D093","Carcinome in situ de la thyroïde et autres glandes endocrines","19","18","1,94","1 à 10","0","0"
"D097","Carcinome in situ d'autres sièges précisés","11","1 à 10","NA","1 à 10","0","0"
"","Total","1 422","1 254","","168","","0"
