Code,Libellé,Nb total de séjours/séances,Nb de séjourshors GHM en J ou T et séances,DMS (en nuitée)hors GHM en J ou Tet séances,Nb de séjoursGHM en J ou T hors séances,Nb de nuitéesen GHM J ou T,Nb de séances
S630,Luxation du poignet,323,243,"2,30",80,0,0
S631,Luxation du doigt,1 292,766,"1,19",526,0,0
S632,Luxations multiples des doigts,79,47,"1,23",32,0,0
S633,Rupture traumatique de ligament du poignet et du carpe,221,44,"1,30",177,0,0
S634,Rupture traumatique de ligaments du doigt au niveau des articulations métacarpo-phalangienne et interphalangienne,412,62,"1,44",350,0,0
S635,Entorse et foulure du poignet,305,266,"0,71",39,0,0
S636,Entorse et foulure de doigt(s),355,120,"0,81",235,0,0
S637,Entorse et foulure d'articulations autres et non précisées de la main,48,44,"0,27",1 à 10,0,0
"",Total,3 035,1 592,"",1 443,"",0
