Code,Libellé,Nb total de séjours/séances,Nb de séjourshors GHM en J ou T et séances,DMS (en nuitée)hors GHM en J ou Tet séances,Nb de séjoursGHM en J ou T hors séances,Nb de nuitéesen GHM J ou T,Nb de séances
Z022,Examen pour l'admission dans une autre institution,12,1 à 10,NA,1 à 10,1 à 10,0
Z024,Examen pour le permis de conduire,12,0,"",12,0,0
Z025,Examen pour la pratique d'un sport,64,0,"",64,0,0
Z027,Délivrance d'un certificat médical,81,19,"2,58",62,15,0
Z028,Autres examens à des fins administratives,48,1 à 10,NA,38,23,0
Z029,"Examen à des fins administratives, sans précision",24,1 à 10,NA,22,1 à 10,0
"",Total,249,37,"",212,"",0
