Code,Libellé,Nb total de séjours/séances,Nb de séjourshors GHM en J ou T et séances,DMS (en nuitée)hors GHM en J ou Tet séances,Nb de séjoursGHM en J ou T hors séances,Nb de nuitéesen GHM J ou T,Nb de séances
S010,Plaie ouverte du cuir chevelu,7 954,4 853,"2,46",3 101,0,0
S011,Plaie ouverte de la paupière et de la région péri-oculaire,4 059,2 352,"2,47",1 707,0,0
S012,Plaie ouverte du nez,703,401,"2,00",302,0,0
S013,Plaie ouverte de l'oreille,670,134,"5,23",536,236,0
S014,Plaie ouverte de la joue et de la région temporo-maxillaire,694,423,"2,04",271,0,0
S015,Plaie ouverte de la lèvre et de la cavité buccale,2 023,1 180,"1,98",843,1 à 10,0
S017,Plaies ouvertes multiples de la tête,804,492,"1,78",312,0,0
S018,Plaie ouverte d'autres parties de la tête,5 499,3 209,"2,24",2 290,0,0
"",Total,22 406,13 044,"",9 362,"",0
