Code,Libellé,Nb total de séjours/séances,Nb de séjourshors GHM en J ou T et séances,DMS (en nuitée)hors GHM en J ou Tet séances,Nb de séjoursGHM en J ou T hors séances,Nb de nuitéesen GHM J ou T,Nb de séances
210100000,Sujets en contact avex les services de santé pour des examens divers,1 135 267,686 417,"0,42",448 850,13 944,0
210200000,Sujets pouvant courir un risque lié à des maladies transmissibles,58 447,56 271,"0,10",2 176,683,0
210300000,Sujets ayant recours aux services de santé pour des motifs liés à la reproduction,546 047,474 196,"3,53",71 851,453,0
210400000,Sujets ayant recours aux services de santé pour des actes médicaux et des soins spécifiques,8 728 779,415 499,"5,67",442 240,114 120,7 871 040
210500000,Sujets dont la santé peut être menacée par des conditions socio-économiques et psycho-sociales,4 752,2 079,"8,67",2 673,1 446,0
210600000,Sujets ayant recours aux services de santé pour d'autres motifs,95 528,35 572,"8,98",59 956,3 048,0
210700000,Sujets dont la santé peut être menancée en raison d'antécédents personnels et familiaux et de certaines affections,176 384,77 332,"0,87",99 052,340,0
"",Total,10 745 204,1 747 366,"",1 126 798,"",7 871 040
