Code,Libellé,Nb total de séjours/séances,Nb de séjourshors GHM en J ou T et séances,DMS (en nuitée)hors GHM en J ou Tet séances,Nb de séjoursGHM en J ou T hors séances,Nb de nuitéesen GHM J ou T,Nb de séances
Q892,Malformations congénitales des autres glandes endocrines,899,845,"2,09",54,15,0
Q893,Situs inversus,21,14,"9,29",1 à 10,1 à 10,0
Q897,"Malformations congénitales multiples, non classées ailleurs",73,15,"16,40",58,0,0
Q898,Autres malformations congénitales précisées,25,12,"2,75",13,0,0
"",Total,1 033,890,"",143,"",0
