Code,Libellé,Nb total de séjours/séances,Nb de séjourshors GHM en J ou T et séances,DMS (en nuitée)hors GHM en J ou Tet séances,Nb de séjoursGHM en J ou T hors séances,Nb de nuitéesen GHM J ou T,Nb de séances
P50,Perte de sang foetal,18,18,"9,33",0,0,0
P52,Hémorragie intracrânienne non traumatique du foetus et du nouveau-né,156,154,"13,40",1 à 10,0,0
P54,Autres hémorragies néonatales,272,266,"5,21",1 à 10,1 à 10,0
P55,Maladie hémolytique du foetus et du nouveau-né,2 259,2 259,"6,17",0,0,0
P57,Ictère nucléaire,141,141,"6,01",0,0,0
P58,Ictère néonatal dû à d'autres hémolyses excessives,1 353,1 353,"5,26",0,0,0
P59,Ictère néonatal dû à des causes autres et sans précision,9 316,9 316,"4,92",0,0,0
P61,Autres affections hématologiques de la période périnatale,675,675,"7,87",0,0,0
"",Total,14 199,14 190,"",1 à 10,"",0
