Code,Libellé,Nb total de séjours/séances,Nb de séjourshors GHM en J ou T et séances,DMS (en nuitée)hors GHM en J ou Tet séances,Nb de séjoursGHM en J ou T hors séances,Nb de nuitéesen GHM J ou T,Nb de séances
P020,Foetus et nouveau-né affectés par placenta praevia,37,37,"10,51",0,0,0
P021,Foetus et nouveau-né affectés par d'autres formes de décollement et d'hémorragie placentaires,32,32,"7,47",0,0,0
P022,"Foetus et nouveau-né affectés par des anomalies morphologiques et fonctionnelles du placenta, autres et sans précision",13,13,"3,46",0,0,0
P023,Foetus et nouveau-né affectés par des syndromes de transfusion placentaire,32,32,"10,22",0,0,0
P025,Foetus et nouveau-né affectés par d'autres formes de compression du cordon ombilical,365,365,"3,70",0,0,0
P026,"Foetus et nouveau-né affectés par des affections du cordon ombilical, autres et sans précision",119,117,"3,91",1 à 10,0,0
P027,Foetus et nouveau-né affectés par une chorio-amniotite,96,96,"8,04",0,0,0
"",Total,711,708,"",1 à 10,"",0
