Code,Libellé,Nb total de séjours/séances,Nb de séjourshors GHM en J ou T et séances,DMS (en nuitée)hors GHM en J ou Tet séances,Nb de séjoursGHM en J ou T hors séances,Nb de nuitéesen GHM J ou T,Nb de séances
T29,Brûlures et corrosions de parties multiples du corps,189,113,"8,30",76,32,0
T30,"Brûlure et corrosion, partie du corps non précisée",70,21,"5,67",49,13,0
T31,Brûlures classées selon l'étendue de la surface du corps atteinte,4 170,2 073,"16,18",2 097,161,0
T32,Corrosions classées selon l'étendue de la surface du corps atteinte,386,90,"4,10",296,0,0
"",Total,4 815,2 297,"",2 518,"",0
