Code,Libellé,Nb total de séjours/séances,Nb de séjourshors GHM en J ou T et séances,DMS (en nuitée)hors GHM en J ou Tet séances,Nb de séjoursGHM en J ou T hors séances,Nb de nuitéesen GHM J ou T,Nb de séances
S700,Contusion de la hanche,4 859,3 658,"4,67",1 201,0,0
S701,Contusion de la cuisse,2 056,1 726,"6,60",330,0,0
S707,Lésions traumatiques superficielles multiples de la hanche et de la cuisse,83,65,"2,83",18,0,0
S708,Autres lésions traumatiques superficielles de la hanche et de la cuisse,226,169,"4,07",57,0,0
S709,"Lésion traumatique superficielle de la hanche et de la cuisse, sans précision",133,65,"2,62",68,0,0
"",Total,7 357,5 683,"",1 674,"",0
