Code,Libellé,Nb total de séjours/séances,Nb de séjourshors GHM en J ou T et séances,DMS (en nuitée)hors GHM en J ou Tet séances,Nb de séjoursGHM en J ou T hors séances,Nb de nuitéesen GHM J ou T,Nb de séances
I70,Athérosclérose,32 258,24 805,"9,20",7 453,3 352,0
I71,Anévrisme aortique et dissection,14 470,11 745,"10,13",2 725,898,0
I72,Autres anévrismes et dissections,7 076,5 688,"7,13",1 388,497,0
I73,Autres maladies vasculaires périphériques,1 461,740,"7,01",721,90,0
I74,Embolie et thrombose artérielles,31 051,23 417,"8,18",7 634,3 673,0
I77,Autres atteintes des artères et artérioles,8 367,4 725,"4,96",3 642,874,0
I78,Maladies des capillaires,431,178,"7,19",253,32,0
I79,"Atteintes des artères, artérioles et capillaires au cours de maladies classées ailleurs",1 009,741,"9,64",268,39,0
"",Total,96 123,72 039,"",24 084,"",0
