Code,Libellé,Nb total de séjours/séances,Nb de séjourshors GHM en J ou T et séances,DMS (en nuitée)hors GHM en J ou Tet séances,Nb de séjoursGHM en J ou T hors séances,Nb de nuitéesen GHM J ou T,Nb de séances
M500,Atteinte d'un disque cervical avec myélopathie (G99.2),475,459,"5,88",16,1 à 10,0
M501,Atteinte d'un disque cervical avec radiculopathie,2 104,1 988,"2,96",116,29,0
M502,Autre hernie d'un disque cervical,551,458,"3,41",93,47,0
M503,Autre détérioration d'un disque cervical,37,30,"3,57",1 à 10,1 à 10,0
M508,Autres atteintes d'un disque cervical,192,174,"1,79",18,1 à 10,0
M509,"Atteinte d'un disque cervical, sans précision",22,11,"3,64",11,1 à 10,0
"",Total,3 381,3 120,"",261,"",0
