Code,Libellé,Nb total de séjours/séances,Nb de séjourshors GHM en J ou T et séances,DMS (en nuitée)hors GHM en J ou Tet séances,Nb de séjoursGHM en J ou T hors séances,Nb de nuitéesen GHM J ou T,Nb de séances
S910,Plaie ouverte de la cheville,585,393,"4,91",192,0,0
S911,Plaie ouverte d'un (des) orteil(s) (sans lésion de l'ongle),726,333,"4,81",393,0,0
S912,Plaie ouverte d'un (des) orteil(s) avec lésion de l'ongle,285,125,"4,48",160,0,0
S913,Plaie ouverte d'autres parties du pied,1 762,946,"4,19",816,0,0
S917,Plaies ouvertes multiples de la cheville et du pied,194,107,"4,30",87,0,0
"",Total,3 552,1 904,"",1 648,"",0
